review_id,section_header,ref_marker,target_xml_id,raw_citation,doi,title,year
20_Buller_2023_Science,Conclusions,(152),b151,Biocatalysis in Drug Development—Highlights of the Recent Patent Literature David L Hughes 0000-0001-5880-8529 10.1021/acs.oprd.8b00232 Organic Process Research & Development Org. Process Res. Dev. 1083-6160 1520-586X 22 9 2018 American Chemical Society (ACS),10.1021/acs.oprd.8b00232,Biocatalysis in Drug Development—Highlights of the Recent Patent Literature,2018
20_Buller_2023_Science,Conclusions,"(119,",b118,Opportunities and challenges for combining chemo- and biocatalysis Florian Rudroff 0000-0002-6680-8200 Marko D Mihovilovic 0000-0002-5438-8368 Harald Gröger 0000-0001-8582-2107 Radka Snajdrova 0000-0002-4809-1066 Hans Iding 0000-0002-4638-7912 Uwe T Bornscheuer 0000-0003-0685-2696 10.1038/s41929-017-0010-4 Nature Catalysis Nat Catal 2520-1158 1 1 2018 Springer Science and Business Media LLC,10.1038/s41929-017-0010-4,Opportunities and challenges for combining chemo- and biocatalysis,2018
20_Buller_2023_Science,Conclusions,"153,",b152,Expanding the Synthetic Toolbox through Metal–Enzyme Cascade Reactions Sergio González-Granda Jesús Albarrán-Velo Iván Lavandera 0000-0003-4857-4428 Vicente Gotor-Fernández 0000-0002-9998-0656 10.1021/acs.chemrev.2c00454 Chemical Reviews Chem. Rev. 0009-2665 1520-6890 123 9 2023 American Chemical Society (ACS) pmid,10.1021/acs.chemrev.2c00454,Expanding the Synthetic Toolbox through Metal–Enzyme Cascade Reactions,2023
20_Buller_2023_Science,Conclusions,154),b153,Where Chemocatalysis Meets Biocatalysis: In Water Harald Gröger 0000-0001-8582-2107 Fabrice Gallou 0000-0001-8996-6079 Bruce H Lipshutz 0000-0001-9116-7049 10.1021/acs.chemrev.2c00416 Chemical Reviews Chem. Rev. 0009-2665 1520-6890 123 9 2023 American Chemical Society (ACS) pmid,10.1021/acs.chemrev.2c00416,Where Chemocatalysis Meets Biocatalysis: In Water,2023
20_Buller_2023_Science,Conclusions,(54),b53,De novo design of luciferases using deep learning A H -W Yeh 10.1038/s41586-023-05696-3 Nature 614 2023,10.1038/s41586-023-05696-3,De novo design of luciferases using deep learning,2023
20_Buller_2023_Science,Conclusions,(98),b97,De novo protein design by deep network hallucination Ivan Anishchenko 0000-0003-3645-2044 Samuel J Pellock 0000-0002-7557-7985 Tamuka M Chidyausiku 0000-0002-2561-782X Theresa A Ramelot 0000-0002-0335-1573 Sergey Ovchinnikov 0000-0003-2774-2744 Jingzhou Hao Khushboo Bafna 0000-0002-1893-1175 Christoffer Norn 0000-0002-1450-4651 Alex Kang Asim K Bera 0000-0001-9473-2912 Frank Dimaio Lauren Carter Cameron M Chow 0000-0001-5351-6412 Gaetano T Montelione 0000-0002-9440-3059 David Baker 0000-0001-7896-6217 10.1038/s41586-021-04184-w Nature Nature 0028-0836 1476-4687 600 7889 2021 Springer Science and Business Media LLC,10.1038/s41586-021-04184-w,De novo protein design by deep network hallucination,2021
